{
  "schema_version": "1.0.0",
  "registry_id": "NFL-FIDOS-CONCEPT-TEMPLATES",
  "coordinate_contract": "Assignment points are snap-relative field offsets from the named alignment slot.",
  "templates": [
    {
      "id": "TPL-OFF-DAGGER-2X2", "name": "Dagger 2x2", "unit": "offense", "template_kind": "concept_layer", "layer": "route_concept", "formation": "shotgun_2x2", "personnel": "11", "concept": "Dagger", "version": "1.0.0", "status": "approved", "scope": "system",
      "description": "Vertical clear with an intermediate dig and a back-side access answer.", "tags": ["dropback", "middle-open", "third-down"], "situations": ["2nd-and-medium", "3rd-and-medium"], "expected_companion_layers": ["protection"],
      "coaching_points": ["Clear the near safety before the dig enters the window.", "QB confirms middle-field structure before hitching to the dig."],
      "timeline": {"duration_ms": 3000, "markers": [{"id": "READ-MOF", "label": "Confirm middle-field safety", "kind": "read", "ms": 450}, {"id": "THROW-DIG", "label": "Dig throw window", "kind": "cue", "ms": 1700}]},
      "assignments": [
        {"key": "H-SEAM", "slot": "H", "kind": "route", "type": "seam", "arrow_style": "route", "objective": "Clear the near safety", "landmark": "near upright", "depth_yards": 22, "points": [{"dx": 0, "dy": 0}, {"dx": 0, "dy": -23}], "timing": {"start_ms": 0, "end_ms": 2400}},
        {"key": "Y-DIG", "slot": "Y", "kind": "route", "type": "dig", "arrow_style": "route", "objective": "Cross the vacated intermediate window", "landmark": "18-yard hash", "depth_yards": 18, "depends_on": ["H-SEAM"], "points": [{"dx": 0, "dy": 0}, {"dx": 0, "dy": -17}, {"dx": -24, "dy": -17}], "timing": {"start_ms": 0, "end_ms": 2200}},
        {"key": "X-COMEBACK", "slot": "X", "kind": "route", "type": "comeback", "arrow_style": "route", "objective": "Win the boundary access throw", "depth_yards": 15, "points": [{"dx": 0, "dy": 0}, {"dx": 0, "dy": -17}, {"dx": 4, "dy": -13}], "timing": {"start_ms": 0, "end_ms": 1850}},
        {"key": "Z-GO", "slot": "Z", "kind": "route", "type": "go", "arrow_style": "route", "objective": "Remove the corner", "points": [{"dx": 0, "dy": 0}, {"dx": 0, "dy": -25}], "timing": {"start_ms": 0, "end_ms": 2500}},
        {"key": "RB-CHECK", "slot": "RB", "kind": "route", "type": "flat", "arrow_style": "route", "objective": "Check protection, then replace pressure", "technique": "scan inside-out", "points": [{"dx": 0, "dy": 0}, {"dx": 11, "dy": -5}], "timing": {"start_ms": 350, "end_ms": 1450}},
        {"key": "QB-READ", "slot": "QB", "kind": "read", "type": "safety_key", "objective": "Read clear to dig to access", "read_key": "middle-field safety", "target_element_key": "Y-DIG", "depends_on": ["H-SEAM"], "timing": {"start_ms": 0, "end_ms": 1750}}
      ]
    },
    {
      "id": "TPL-OFF-FLOOD-TRIPS", "name": "Trips Flood", "unit": "offense", "template_kind": "concept_layer", "layer": "route_concept", "formation": "shotgun_trips", "personnel": "11", "concept": "Flood", "version": "1.0.0", "status": "approved", "scope": "system",
      "description": "Three-level sideline stretch with a controlled back-side answer.", "tags": ["play-action", "zone-stretch", "sideline"], "situations": ["early-down", "move-the-pocket"], "expected_companion_layers": ["protection"],
      "coaching_points": ["Maintain vertical spacing between clear, sail, and flat.", "QB works high to low unless the back-side access is declared."],
      "timeline": {"duration_ms": 3000, "markers": [{"id": "FLOOD-EDGE", "label": "Clear edge defender", "kind": "read", "ms": 650}, {"id": "FLOOD-SAIL", "label": "Sail window", "kind": "cue", "ms": 1550}]},
      "assignments": [
        {"key": "Z-CLEAR", "slot": "Z", "kind": "route", "type": "go", "arrow_style": "route", "objective": "Clear the deep third", "points": [{"dx": 0, "dy": 0}, {"dx": 0, "dy": -25}], "timing": {"start_ms": 0, "end_ms": 2500}},
        {"key": "H-SAIL", "slot": "H", "kind": "route", "type": "corner", "arrow_style": "route", "objective": "Attack the intermediate sideline", "landmark": "18 yards at sideline", "depends_on": ["Z-CLEAR"], "points": [{"dx": 0, "dy": 0}, {"dx": 0, "dy": -12}, {"dx": 15, "dy": -21}], "timing": {"start_ms": 0, "end_ms": 2100}},
        {"key": "Y-FLAT", "slot": "Y", "kind": "route", "type": "flat", "arrow_style": "route", "objective": "Control the flat defender", "points": [{"dx": 0, "dy": 0}, {"dx": 13, "dy": -4}], "timing": {"start_ms": 0, "end_ms": 1200}},
        {"key": "X-DIG", "slot": "X", "kind": "route", "type": "dig", "arrow_style": "route", "objective": "Provide the back-side intermediate answer", "points": [{"dx": 0, "dy": 0}, {"dx": 0, "dy": -14}, {"dx": 18, "dy": -14}], "timing": {"start_ms": 0, "end_ms": 2050}},
        {"key": "QB-EDGE-READ", "slot": "QB", "kind": "read", "type": "flat_defender", "objective": "Read clear to sail to flat", "read_key": "force/flat defender", "target_element_key": "H-SAIL", "timing": {"start_ms": 250, "end_ms": 1700}}
      ]
    },
    {
      "id": "TPL-OFF-MESH-2X2", "name": "Mesh Traffic", "unit": "offense", "template_kind": "concept_layer", "layer": "route_concept", "formation": "shotgun_2x2", "personnel": "11", "concept": "Mesh", "version": "1.0.0", "status": "approved", "scope": "system",
      "description": "Paired shallow crossers with a sit route, wheel answer, and man/zone rules.", "tags": ["quick-game", "man-beater", "zone-settle"], "situations": ["3rd-and-short", "red-zone"], "expected_companion_layers": ["protection"],
      "coaching_points": ["Crossers set the mesh at six yards without colliding.", "Settle versus zone and run away versus man."],
      "timeline": {"duration_ms": 2600, "markers": [{"id": "MESH-CROSS", "label": "Mesh point", "kind": "cue", "ms": 900}, {"id": "MESH-SETTLE", "label": "Man/zone decision", "kind": "pause", "ms": 1250}]},
      "assignments": [
        {"key": "H-DRAG", "slot": "H", "kind": "route", "type": "drag", "arrow_style": "route", "objective": "Set the front edge of the mesh", "landmark": "six yards", "points": [{"dx": 0, "dy": 0}, {"dx": 5, "dy": -6}, {"dx": 51, "dy": -6}], "timing": {"start_ms": 0, "end_ms": 1800}},
        {"key": "Y-DRAG", "slot": "Y", "kind": "route", "type": "drag", "arrow_style": "route", "objective": "Trail under the first crosser", "landmark": "six yards", "exchange_with": "H-DRAG", "points": [{"dx": 0, "dy": 0}, {"dx": -5, "dy": -6}, {"dx": -51, "dy": -6}], "timing": {"start_ms": 100, "end_ms": 1900}},
        {"key": "X-POST", "slot": "X", "kind": "route", "type": "post", "arrow_style": "route", "objective": "Remove the post safety", "points": [{"dx": 0, "dy": 0}, {"dx": 0, "dy": -15}, {"dx": 14, "dy": -25}], "timing": {"start_ms": 0, "end_ms": 2350}},
        {"key": "Z-CORNER", "slot": "Z", "kind": "route", "type": "corner", "arrow_style": "route", "objective": "Create the high-low with the crosser", "points": [{"dx": 0, "dy": 0}, {"dx": 0, "dy": -12}, {"dx": -12, "dy": -21}], "timing": {"start_ms": 0, "end_ms": 2200}},
        {"key": "RB-WHEEL", "slot": "RB", "kind": "route", "type": "wheel", "arrow_style": "route", "objective": "Punish low-hole leverage", "points": [{"dx": 0, "dy": 0}, {"dx": 12, "dy": -5}, {"dx": 16, "dy": -17}], "timing": {"start_ms": 200, "end_ms": 2200}},
        {"key": "QB-MESH-READ", "slot": "QB", "kind": "read", "type": "man_zone_key", "objective": "Work wheel to mesh to settle", "read_key": "low-hole defender", "target_element_key": "H-DRAG", "timing": {"start_ms": 0, "end_ms": 1650}}
      ]
    },
    {
      "id": "TPL-OFF-IZ-RPO", "name": "Inside Zone RPO", "unit": "offense", "template_kind": "complete_call", "layer": "run_rpo", "formation": "shotgun_2x2", "personnel": "11", "concept": "Inside Zone / Glance", "version": "1.0.0", "status": "approved", "scope": "system",
      "description": "Interior zone track paired with a conflict-defender glance read.", "tags": ["run", "rpo", "conflict-read"], "situations": ["early-down", "high-red"], "expected_companion_layers": [],
      "coaching_points": ["Line owns the declared zone track independent of the throw key.", "QB gives unless the conflict defender closes the fit."],
      "timeline": {"duration_ms": 2300, "markers": [{"id": "IZ-MESH", "label": "Mesh decision", "kind": "handoff", "ms": 450}, {"id": "IZ-CONFLICT", "label": "Conflict defender declared", "kind": "read", "ms": 600}]},
      "assignments": [
        {"key": "RB-IZ", "slot": "RB", "kind": "run", "type": "inside_zone", "arrow_style": "run", "objective": "Press play-side A gap and bend behind displacement", "landmark": "play-side leg of center", "points": [{"dx": 0, "dy": 0}, {"dx": -5, "dy": -6}, {"dx": -3, "dy": -18}], "timing": {"start_ms": 0, "end_ms": 1750}},
        {"key": "X-GLANCE", "slot": "X", "kind": "route", "type": "slant", "arrow_style": "route", "objective": "Replace the conflict defender", "depth_yards": 8, "points": [{"dx": 0, "dy": 0}, {"dx": 1, "dy": -6}, {"dx": 13, "dy": -12}], "timing": {"start_ms": 0, "end_ms": 1300}},
        {"key": "Y-ARC", "slot": "Y", "kind": "block", "type": "arc", "arrow_style": "block", "objective": "Arc to support unless tagged otherwise", "points": [{"dx": 0, "dy": 0}, {"dx": 7, "dy": -6}], "timing": {"start_ms": 0, "end_ms": 1100}},
        {"key": "LT-ZONE", "slot": "LT", "kind": "block", "type": "zone", "arrow_style": "block", "objective": "Reach or overtake first play-side threat", "gap": "B", "points": [{"dx": 0, "dy": 0}, {"dx": -2, "dy": -6}], "timing": {"start_ms": 0, "end_ms": 1050}},
        {"key": "LG-ZONE", "slot": "LG", "kind": "block", "type": "zone", "arrow_style": "block", "objective": "Combination to second level", "gap": "A", "points": [{"dx": 0, "dy": 0}, {"dx": -1, "dy": -6}], "timing": {"start_ms": 0, "end_ms": 1050}},